{
  "$schema": "https://json-schema.org/draft/2020-12/schema",
  "$id": "urn:openmasu:schema:rejection:v0.4",
  "title": "OpenMasu Rejection v0.4",
  "type": "object",
  "additionalProperties": false,
  "required": ["contract_version", "delivery_id", "record_id", "tenant_id", "app_id", "reason_code", "reason_code_version", "payload_disposition", "retained", "consent_evaluation_policy_version", "consent_decision_reason_code"],
  "properties": {
    "contract_version": { "const": "0.4.0" },
    "delivery_id": { "$ref": "common.schema.json#/$defs/id" },
    "record_id": { "$ref": "common.schema.json#/$defs/id" },
    "tenant_id": { "$ref": "common.schema.json#/$defs/id" },
    "app_id": { "$ref": "common.schema.json#/$defs/id" },
    "reason_code": { "enum": ["client_scope_mismatch", "consent_withdrawn", "aggregate_installation_join_forbidden", "event_id_conflict", "record_id_collision", "payload_schema_invalid", "timestamp_invalid", "timestamp_stale", "refund_target_invalid"] },
    "reason_code_version": { "const": "0.4.0" },
    "payload_disposition": { "enum": ["discarded", "protected"] },
    "retained": { "enum": ["non_identifying_metadata", "protected_conflict_evidence"] },
    "processing_purpose_id": { "$ref": "common.schema.json#/$defs/processingPurposeId" },
    "consent_evaluation_policy_version": { "type": "string", "minLength": 1 },
    "consent_decision_reason_code": { "enum": ["consent_not_required", "consent_valid_before_withdrawal", "documented_alternative_legal_basis", "consent_withdrawn"] },
    "withdrawal_recognized_at": { "$ref": "common.schema.json#/$defs/dateTime" },
    "staleness_policy_version": { "type": "string", "minLength": 1 },
    "staleness_policy_digest": { "type": "string", "pattern": "^[a-f0-9]{64}$" },
    "staleness_authority": { "const": "server" }
  },
  "allOf": [
    {
      "if": { "properties": { "reason_code": { "const": "timestamp_stale" } }, "required": ["reason_code"] },
      "then": {
        "properties": {
          "staleness_policy_version": {},
          "staleness_policy_digest": {},
          "staleness_authority": {}
        },
        "required": ["staleness_policy_version", "staleness_policy_digest", "staleness_authority"]
      }
    }
  ]
}
