[
  {
    "contract_version": "0.4.0",
    "delivery_id": "delivery:event-after-withdrawal",
    "record_id": "event-after-withdrawal",
    "tenant_id": "tenant-a",
    "app_id": "app-a",
    "reason_code": "consent_withdrawn",
    "reason_code_version": "0.4.0",
    "payload_disposition": "discarded",
    "retained": "non_identifying_metadata",
    "processing_purpose_id": "analytics",
    "consent_evaluation_policy_version": "consent-v1",
    "consent_decision_reason_code": "consent_withdrawn",
    "withdrawal_recognized_at": "2026-08-12T00:00:00.000Z"
  }
]
